{
  "$schema": "../../demo.schema.json",
  "schemaVersion": 1,
  "hodId": "ANSIBLE-HOD-001",
  "id": "install-upstream-with-pipx-rhel",
  "demoId": "ANSIBLE-HOD-001-D03",
  "title": "Install upstream ansible-core with pipx on RHEL 9",
  "objective": "Register RHEL, install a supported Python and pipx, create an isolated upstream ansible-core application, record and recreate its exact package baseline, restore its pin, and verify its provenance, content boundary, and runtime behavior.",
  "coverImage": "/demos/installing-ansible-core/demo-03-pipx.svg",
  "coverAlt": "pipx managing an isolated upstream ansible-core application environment and exposing commands on the current user's PATH",
  "outcomes": [
    "Register RHEL and confirm its Red Hat service connections",
    "Select a maintained upstream ansible-core and compatible control-node Python",
    "Install Python 3.12 without replacing RHEL's platform Python",
    "Install pipx in the current user's Python package directory",
    "Persist the user application directory on PATH",
    "Install upstream ansible-core from PyPI in a pipx-managed environment",
    "Record and recreate the exact pipx application package baseline, then restore its pin",
    "Verify isolation, content boundaries, and functional execution"
  ],
  "duration": "22 min",
  "durationMinutes": 22,
  "validationBoundary": "This proves that pipx owns an isolated upstream ansible-core application environment and that its exposed commands work on the local control node. It does not validate remote inventory, SSH connectivity, credentials, privilege escalation, network policy, or managed-host Python readiness.",
  "nextActions": [
    "Save the pipx inventory, exact requirements, rebuild result, and pin status with the project or workstation notes that depend on it.",
    "Use pipx as the sole owner for inspecting, upgrading, pinning, or removing this application environment.",
    "Repeat the isolation, dependency, documentation, and ansible.builtin.ping checks after approved updates.",
    "Validate inventory, transport, credentials, privilege escalation, and Python against a managed Linux host."
  ],
  "steps": [
    {
      "label": "System Baseline",
      "title": "Inspect the clean RHEL environment",
      "image": "/demos/installing-ansible-core/assets/pipx-rhel-01-starting-state.svg",
      "alt": "Terminal showing the RHEL 9 release, processor architecture, ansible-core RPM state, and default Python version",
      "explanation": "Establish the operating-system, processor architecture, Ansible RPM state, and default Python version before selecting packages. This baseline distinguishes the later upstream installation from software already managed by RHEL.",
      "commands": [
        {
          "command": "cat /etc/redhat-release",
          "explanation": "Reads the RHEL release file to identify the installed operating-system name and major release."
        },
        {
          "command": "uname -m",
          "explanation": "Reports the processor architecture, which determines which architecture-specific repositories and packages apply to the host."
        },
        {
          "command": "rpm -q ansible-core",
          "explanation": "Queries the RPM database for the RHEL-provided ansible-core package. A not-installed result confirms the clean package state expected here."
        },
        {
          "command": "python3 --version",
          "explanation": "Shows the version behind RHEL's default python3 command before an additional interpreter is installed."
        }
      ],
      "expected": "The host reports RHEL 9 and its architecture, confirms that the ansible-core RPM is absent, and displays the default Python version.",
      "note": "This recording uses an aarch64 VM. Package architecture differs on x86_64 systems.",
      "troubleshooting": "If the system is not RHEL 9, stop and use the guidance for that platform. If ansible-core is already installed through RPM, pip, pipx, or another environment, do not continue on this system; reset it or use a separate clean RHEL 9 environment so package ownership and PATH results remain unambiguous.",
      "media": {
        "type": "terminal",
        "source": "/demos/installing-ansible-core/recordings/pipx-rhel-01-starting-state.cast",
        "transcript": "/demos/installing-ansible-core/recordings/pipx-rhel-01-starting-state.txt"
      }
    },
    {
      "label": "Register RHEL",
      "title": "Register RHEL with Red Hat services",
      "image": "/demos/installing-ansible-core/assets/02-registration-complete.png",
      "alt": "RHEL terminal confirming successful connections to Red Hat services",
      "explanation": "A registered RHEL system can retrieve protected content from Red Hat repositories. This demonstration uses an interactive Red Hat account login and keeps all credential input outside the published replay.",
      "commands": [
        {
          "command": "sudo rhc connect",
          "explanation": "Runs the Red Hat connector with administrative privileges. It registers the system with Subscription Management and connects it to Red Hat Lightspeed."
        }
      ],
      "expected": "rhc reports successful connections to Red Hat Subscription Management and Red Hat Lightspeed and activates remote host configuration. The recorded client uses the former Red Hat Insights name in its output.",
      "note": "Credential input is excluded from the replay. The neutral placeholders show where learners interact without exposing an account name or password.",
      "troubleshooting": "Use the message returned by rhc connect to distinguish an interactive-login problem from a registration or service-connection failure.",
      "recovery": [
        {
          "symptom": "No credential prompt appears",
          "detail": "Run rhc connect from an interactive terminal. A background process or non-interactive shell cannot accept the Red Hat account prompts."
        },
        {
          "symptom": "Authentication or registration fails",
          "detail": "Confirm network access, DNS, proxy configuration, system time, and an active RHEL entitlement, then retry this registration step.",
          "command": "sudo rhc connect"
        }
      ],
      "media": {
        "type": "terminal",
        "source": "/demos/installing-ansible-core/recordings/02-register.cast",
        "transcript": "/demos/installing-ansible-core/recordings/02-register.txt"
      }
    },
    {
      "label": "Verify Connection",
      "title": "Verify the Red Hat connection",
      "image": "/demos/installing-ansible-core/assets/03-registration-status.png",
      "alt": "RHEL terminal showing active Subscription Management and Red Hat hosted inventory connections",
      "explanation": "Registration should be confirmed independently before relying on protected repositories. The connection status separates a successful login from a usable registered system.",
      "commands": [
        {
          "command": "sudo rhc status",
          "explanation": "Reports the system's current connections to Subscription Management, Red Hat Lightspeed, and remote host configuration services."
        }
      ],
      "expected": "The recorded system is connected to Red Hat Subscription Management and Red Hat Lightspeed. The recorded client uses the former Red Hat Insights name, and remote host configuration may be inactive.",
      "note": "Subscription Management is required for DNF repository access. Red Hat Lightspeed and remote host configuration are separate services; their state does not determine whether DNF can use subscribed repositories.",
      "troubleshooting": "Read each rhc status line separately. Return to registration when Subscription Management is disconnected; do not treat an inactive Lightspeed or remote host configuration connection as a DNF repository failure.",
      "recovery": [
        {
          "symptom": "Subscription Management is disconnected",
          "detail": "Return to the interactive registration step, confirm the entitled RHEL account and network path, then repeat the connection check.",
          "command": "sudo rhc connect\nsudo rhc status"
        },
        {
          "symptom": "Only Lightspeed or remote host configuration is inactive",
          "detail": "Continue with the DNF workflow when Subscription Management is connected. Investigate the other service only when the organization uses that capability."
        }
      ],
      "media": {
        "type": "terminal",
        "source": "/demos/installing-ansible-core/recordings/03-registration-status.cast",
        "transcript": "/demos/installing-ansible-core/recordings/03-registration-status.txt"
      }
    },
    {
      "label": "Check Repositories",
      "title": "Review the enabled RHEL repositories",
      "image": "/demos/installing-ansible-core/assets/03-enabled-repositories.png",
      "alt": "DNF output listing enabled RHEL BaseOS and AppStream repositories",
      "explanation": "RHEL separates its operating-system foundation and application content into repositories. Both BaseOS and AppStream must be available before the package workflow begins.",
      "commands": [
        {
          "command": "sudo subscription-manager repos --list-enabled",
          "explanation": "Lists repositories enabled in the system's Red Hat subscription configuration, including their full identifiers and status."
        },
        {
          "command": "sudo dnf repolist --enabled",
          "explanation": "Shows the enabled repositories that DNF can currently use. The concise output makes BaseOS and AppStream easy to confirm."
        }
      ],
      "expected": "Both the RHEL 9 BaseOS and AppStream RPM repositories appear as enabled.",
      "note": "Repository IDs include the architecture. This recording uses aarch64; x86_64 systems show corresponding x86_64 repository IDs.",